Serial,Question,Option1,Option2,Option3,Option4,Answer,Topic,Subtopic
1,"What is the probability of getting a head when a coin is tossed once?", "\( \frac{1}{2} \)", "\( 0 \)", "\( \frac{1}{4} \)", "\( \frac{1}{3} \)", "\( \frac{1}{2} \)", "Probability", "coin_toss"
2,"If a coin is tossed thrice, what is the probability of getting at least one head?", "\( \frac{1}{8} \)", "\( \frac{1}{4} \)", "\( \frac{3}{8} \)", "\( \frac{7}{8} \)", "\( \frac{7}{8} \)", "Probability", "coin_toss"
3,"When tossing a coin 5 times, what is the probability of getting exactly 3 heads?", "\( \frac{10}{32} \)", "\( \frac{16}{32} \)", "\( \frac{5}{32} \)", "\( \frac{20}{32} \)", "\( \frac{10}{32} \)", "Probability", "coin_toss"
4,"If a coin is tossed once, what is the probability of getting more than 1 head?", "\( \frac{1}{2} \)", "\( 0 \)", "\( \frac{1}{4} \)", "\( \frac{1}{8} \)", "\( 0 \)", "Probability", "coin_toss"
5,"What is the probability of getting less than 2 heads when a coin is tossed twice?", "\( \frac{3}{4} \)", "\( \frac{1}{4} \)", "\( \frac{1}{2} \)", "\( \frac{1}{8} \)", "\( \frac{3}{4} \)", "Probability", "coin_toss"
6,"What is the probability of rolling a 3 on a fair six-sided die?", "\( \frac{1}{6} \)", "\( \frac{1}{3} \)", "\( \frac{1}{2} \)", "\( \frac{1}{4} \)", "\( \frac{1}{6} \)", "Probability", "die_throw"
7,"What is the probability of rolling an even number on a fair six-sided die?", "\( \frac{1}{6} \)", "\( \frac{1}{2} \)", "\( \frac{1}{3} \)", "\( \frac{1}{4} \)", "\( \frac{1}{2} \)", "Probability", "die_throw"
8,"What is the probability of rolling a number greater than 4 on a fair six-sided die?", "\( \frac{1}{6} \)", "\( \frac{1}{3} \)", "\( \frac{1}{2} \)", "\( \frac{1}{4} \)", "\( \frac{1}{3} \)", "Probability", "die_throw"
9,"What is the probability of rolling a number less than 5 on a fair six-sided die?", "\( \frac{1}{6} \)", "\( \frac{2}{3} \)", "\( \frac{1}{2} \)", "\( \frac{1}{4} \)", "\( \frac{2}{3} \)", "Probability", "die_throw"
10,"What is the probability of rolling a number that is a multiple of 3 on a fair six-sided die?", "\( \frac{1}{6} \)", "\( \frac{1}{3} \)", "\( \frac{1}{2} \)", "\( \frac{1}{4} \)", "\( \frac{1}{3} \)", "Probability", "die_throw"
1,"What is the probability of drawing an Ace from a standard deck of 52 playing cards?", "\( \frac{4}{52} \)", "\( \frac{1}{13} \)", "\( \frac{1}{4} \)", "\( \frac{1}{2} \)", "\( \frac{1}{13} \)", "Probability", "playing_cards"
2,"If one card is drawn from a standard deck of 52 playing cards, what is the probability of drawing a heart?", "\( \frac{13}{52} \)", "\( \frac{1}{4} \)", "\( \frac{1}{2} \)", "\( \frac{3}{13} \)", "\( \frac{1}{4} \)", "Probability", "playing_cards"
3,"What is the probability of drawing 2 Aces in a row from a deck without replacement?", "\( \frac{4}{52} \times \frac{3}{51} \)", "\( \frac{1}{13} \times \frac{3}{51} \)", "\( \frac{1}{13} \times \frac{4}{52} \)", "\( \frac{1}{17} \)", "\( \frac{12}{2652} \)", "Probability", "playing_cards"
4,"If a card is drawn and replaced, what is the probability of drawing a Queen twice in a row?", "\( \frac{4}{52} \times \frac{4}{52} \)", "\( \frac{1}{13} \times \frac{1}{13} \)", "\( \frac{1}{169} \)", "\( \frac{2}{13} \)", "\( \frac{16}{2704} \)", "Probability", "playing_cards"
5,"What is the probability of drawing 1 red card and 1 black card in 2 draws without replacement?", "\( \frac{26}{52} \times \frac{26}{51} \)", "\( \frac{1}{2} \times \frac{1}{2} \)", "\( \frac{26}{52} \times \frac{26}{52} \)", "\( \frac{13}{52} \)", "\( \frac{26}{102} \)", "Probability", "playing_cards"
1,"What is the probability of drawing a heart given that the card drawn is red?", "\( \frac{1}{2} \)", "\( \frac{13}{26} \)", "\( \frac{1}{4} \)", "\( \frac{13}{52} \)", "\( \frac{1}{2} \)", "Probability", "conditional_probability"
2,"If a bag contains 3 red balls and 2 blue balls, what is the probability of drawing a red ball given that a ball drawn is blue?", "\( 0 \)", "\( \frac{3}{5} \)", "\( \frac{2}{5} \)", "\( 1 \)", "\( 0 \)", "Probability", "conditional_probability"
3,"In a class of 30 students, 18 are girls and 12 are boys. What is the probability that a student is a girl given that the student is not a boy?", "\( \frac{3}{5} \)", "\( \frac{6}{10} \)", "\( \frac{18}{30} \)", "\( \frac{18}{12} \)", "\( \frac{18}{18} \)", "Probability", "conditional_probability"
4,"What is the probability of drawing a King given that the card drawn is a face card?", "\( \frac{1}{3} \)", "\( \frac{1}{4} \)", "\( \frac{3}{12} \)", "\( \frac{1}{13} \)", "\( \frac{1}{3} \)", "Probability", "conditional_probability"
5,"If the probability of passing a test is 0.7 and the probability of studying is 0.8, what is the probability of passing the test given that the student studied?", "\( 0.7 \)", "\( 0.56 \)", "\( 0.8 \)", "\( 0.9 \)", "\( 0.7 \)", "Probability", "conditional_probability"
1,"What is the probability of choosing a prime number from the set {1, 2, 3, 4, 5, 6, 7, 8, 9, 10}?", "\( \frac{4}{10} \)", "\( \frac{3}{10} \)", "\( \frac{2}{5} \)", "\( \frac{1}{2} \)", "\( \frac{4}{10} \)", "Probability", "choosing_numbers"
2,"If a number is chosen from the set {1, 2, 3, 4, 5, 6, 7, 8, 9}, what is the probability that it is an odd number?", "\( \frac{4}{9} \)", "\( \frac{5}{9} \)", "\( \frac{1}{2} \)", "\( \frac{3}{9} \)", "\( \frac{5}{9} \)", "Probability", "choosing_numbers"
3,"What is the probability of choosing a number less than 5 from the set {1, 2, 3, 4, 5, 6, 7, 8, 9, 10}?", "\( \frac{4}{10} \)", "\( \frac{5}{10} \)", "\( \frac{6}{10} \)", "\( \frac{3}{10} \)", "\( \frac{4}{10} \)", "Probability", "choosing_numbers"
4,"From the set {1, 2, 3, 4, 5, 6}, what is the probability of selecting an even number?", "\( \frac{2}{6} \)", "\( \frac{1}{2} \)", "\( \frac{3}{6} \)", "\( \frac{4}{6} \)", "\( \frac{3}{6} \)", "Probability", "choosing_numbers"
5,"If a number is randomly selected from the set {1, 2, 3, 4, 5, 6, 7, 8, 9, 10}, what is the probability of it being a composite number?", "\( \frac{4}{10} \)", "\( \frac{5}{10} \)", "\( \frac{6}{10} \)", "\( \frac{7}{10} \)", "\( \frac{4}{10} \)", "Probability", "choosing_numbers"
1,"What is the probability of getting a head and a 4 when tossing a coin and a die?", "\( \frac{1}{12} \)", "\( \frac{1}{6} \)", "\( \frac{1}{2} \)", "\( \frac{1}{4} \)", "\( \frac{1}{12} \)", "Probability", "coin_die"
2,"If a coin is tossed and a die is rolled, what is the probability of getting a tail and an odd number?", "\( \frac{3}{12} \)", "\( \frac{1}{4} \)", "\( \frac{1}{6} \)", "\( \frac{1}{2} \)", "\( \frac{1}{4} \)", "Probability", "coin_die"
3,"What is the probability of getting a head and a number greater than 3 on the die?", "\( \frac{2}{12} \)", "\( \frac{1}{3} \)", "\( \frac{1}{4} \)", "\( \frac{1}{2} \)", "\( \frac{1}{4} \)", "Probability", "coin_die"
4,"When a coin is tossed and a die is rolled, what is the probability of getting heads or a 6?", "\( \frac{7}{12} \)", "\( \frac{2}{3} \)", "\( \frac{1}{2} \)", "\( \frac{5}{12} \)", "\( \frac{7}{12} \)", "Probability", "coin_die"
5,"What is the probability of getting tails and a number less than 3 on the die?", "\( \frac{1}{12} \)", "\( \frac{2}{12} \)", "\( \frac{1}{6} \)", "\( \frac{1}{4} \)", "\( \frac{1}{6} \)", "Probability", "coin_die"
1,"In a box containing 5 red and 3 blue balls, what is the probability of drawing a red ball?", "\( \frac{5}{8} \)", "\( \frac{3}{8} \)", "\( \frac{1}{2} \)", "\( \frac{5}{3} \)", "\( \frac{5}{8} \)", "Probability", "drawing_items"
2,"If you draw 2 balls from a box with 6 white and 4 black balls without replacement, what is the probability that both are black?", "\( \frac{4}{10} \times \frac{3}{9} \)", "\( \frac{4}{10} \times \frac{4}{9} \)", "\( \frac{1}{3} \)", "\( \frac{2}{5} \)", "\( \frac{1}{15} \)", "Probability", "drawing_items"
3,"In an urn with 3 green, 5 yellow, and 2 red balls, what is the probability of drawing a yellow ball?", "\( \frac{5}{10} \)", "\( \frac{1}{2} \)", "\( \frac{1}{3} \)", "\( \frac{5}{12} \)", "\( \frac{5}{10} \)", "Probability", "drawing_items"
4,"What is the probability of drawing a red ball from a box of 10 balls if 4 are red, replacing the ball each time?", "\( \frac{4}{10} \)", "\( \frac{2}{5} \)", "\( \frac{1}{3} \)", "\( \frac{3}{10} \)", "\( \frac{4}{10} \)", "Probability", "drawing_items"
5,"If a box contains 4 green, 3 blue, and 5 red balls, what is the probability of drawing a green ball followed by a red ball without replacement?", "\( \frac{4}{12} \times \frac{5}{11} \)", "\( \frac{1}{3} \times \frac{5}{12} \)", "\( \frac{2}{3} \times \frac{5}{12} \)", "\( \frac{4}{11} \)", "\( \frac{20}{132} \)", "Probability", "drawing_items"
6,"What is the probability of drawing 2 yellow balls in succession from an urn with 3 yellow and 7 white balls without replacement?", "\( \frac{3}{10} \times \frac{2}{9} \)", "\( \frac{3}{10} \times \frac{3}{9} \)", "\( \frac{1}{10} \)", "\( \frac{2}{9} \)", "\( \frac{1}{15} \)", "Probability", "drawing_items"
7,"If you draw a ball from a box of 5 red, 5 green, and 5 blue balls with replacement, what is the probability of drawing a blue ball?", "\( \frac{5}{15} \)", "\( \frac{1}{3} \)", "\( \frac{1}{5} \)", "\( \frac{1}{2} \)", "\( \frac{1}{3} \)", "Probability", "drawing_items"
8,"In a box containing 8 apples and 4 oranges, if you draw one fruit without replacement, what is the probability of drawing an orange first?", "\( \frac{4}{12} \)", "\( \frac{1}{3} \)", "\( \frac{1}{4} \)", "\( \frac{2}{3} \)", "\( \frac{1}{3} \)", "Probability", "drawing_items"
9,"What is the probability of drawing a white ball from a box of 6 white and 4 black balls, replacing the ball after drawing?", "\( \frac{6}{10} \)", "\( \frac{3}{5} \)", "\( \frac{1}{2} \)", "\( \frac{2}{5} \)", "\( \frac{3}{5} \)", "Probability", "drawing_items"
10,"If you draw 2 balls from a box of 3 red and 2 green balls with replacement, what is the probability that both are green?", "\( \frac{2}{5} \times \frac{2}{5} \)", "\( \frac{4}{25} \)", "\( \frac{1}{5} \)", "\( \frac{2}{5} \)", "\( \frac{4}{25} \)", "Probability", "drawing_items"
1,"If P(A) = \( \frac{1}{4} \) and P(B) = \( \frac{1}{2} \), what is P(A|B) if A and B are independent?", "\( \frac{1}{4} \)", "\( \frac{1}{2} \)", "\( \frac{1}{8} \)", "\( \frac{1}{6} \)", "\( \frac{1}{4} \)", "Probability", "conditional_probability"
2,"In a class of 30 students, 18 are girls and 12 are boys. What is the probability of selecting a girl given that a student is selected at random?", "\( \frac{18}{30} \)", "\( \frac{3}{5} \)", "\( \frac{12}{30} \)", "\( \frac{1}{2} \)", "\( \frac{3}{5} \)", "Probability", "conditional_probability"
3,"If P(A) = \( \frac{1}{3} \) and P(A ∩ B) = \( \frac{1}{6} \), what is P(B|A)?", "\( \frac{1}{2} \)", "\( \frac{1}{3} \)", "\( \frac{1}{6} \)", "\( \frac{1}{4} \)", "\( \frac{1}{2} \)", "Probability", "conditional_probability"
4,"In a survey, 70% of people like chocolate, and 30% like vanilla. If 20% like both, what is the probability that a person likes chocolate given they like vanilla?", "\( \frac{0.7}{0.3} \)", "\( \frac{0.2}{0.3} \)", "\( \frac{0.2}{0.7} \)", "\( \frac{0.3}{0.7} \)", "\( \frac{0.2}{0.3} \)", "Probability", "conditional_probability"
5,"If P(A) = \( \frac{3}{5} \) and P(B) = \( \frac{2}{5} \), what is P(A but not B)?", "\( \frac{1}{5} \)", "\( \frac{3}{5} \)", "\( \frac{1}{5} \)", "\( \frac{6}{25} \)", "\( \frac{3}{5} - P(A ∩ B) \)", "Probability", "conditional_probability"
6,"What is the probability of drawing a red card from a deck of cards given that a card drawn is a heart?", "\( \frac{13}{52} \)", "\( \frac{1}{4} \)", "\( \frac{1}{2} \)", "\( \frac{1}{13} \)", "\( 1 \)", "Probability", "conditional_probability"
7,"If there are 4 blue, 5 green, and 3 red marbles in a bag, what is the probability of drawing a green marble given that a marble drawn is not red?", "\( \frac{5}{12} \)", "\( \frac{5}{8} \)", "\( \frac{5}{3} \)", "\( \frac{1}{3} \)", "\( \frac{5}{8} \)", "Probability", "conditional_probability"
8,"If P(A) = \( \frac{1}{2} \) and P(B|A) = \( \frac{1}{3} \), what is P(A ∩ B)?", "\( \frac{1}{6} \)", "\( \frac{1}{3} \)", "\( \frac{1}{2} \)", "\( \frac{1}{8} \)", "\( \frac{1}{6} \)", "Probability", "conditional_probability"
9,"What is P(A only) if P(A) = \( \frac{1}{4} \) and P(A ∩ B) = \( \frac{1}{8} \)?", "\( \frac{1}{8} \)", "\( \frac{1}{4} \)", "\( \frac{1}{2} \)", "\( \frac{1}{16} \)", "\( \frac{1}{8} \)", "Probability", "conditional_probability"
10,"In a city, 40% of people own a car, and 25% own a bike. If 10% own both, what is the probability that a person owns a car but not a bike?", "\( \frac{15}{100} \)", "\( \frac{25}{100} \)", "\( \frac{10}{100} \)", "\( \frac{5}{100} \)", "\( \frac{30}{100} \)", "Probability", "conditional_probability"
11,"If 60% of students passed Math and 30% passed both Math and Science, what is the probability that a student passed Science given they passed Math?", "\( \frac{0.5}{0.3} \)", "\( \frac{0.3}{0.6} \)", "\( \frac{0.3}{0.4} \)", "\( \frac{0.4}{0.3} \)", "\( \frac{0.5}{0.3} \)", "Probability", "conditional_probability"
12,"In a deck of cards, if a card drawn is a face card, what is the probability that it is a king?", "\( \frac{1}{4} \)", "\( \frac{1}{13} \)", "\( \frac{3}{52} \)", "\( \frac{1}{3} \)", "\( \frac{1}{13} \)", "Probability", "conditional_probability"
13,"What is the probability of selecting an odd number from the set {1, 2, 3, 4, 5} given that the number selected is less than 4?", "\( \frac{1}{2} \)", "\( \frac{1}{3} \)", "\( \frac{1}{4} \)", "\( \frac{1}{5} \)", "\( \frac{1}{3} \)", "Probability", "conditional_probability"
14,"If a die is rolled, what is the probability of rolling a 4 given that an even number is rolled?", "\( \frac{1}{2} \)", "\( \frac{1}{3} \)", "\( \frac{1}{4} \)", "\( \frac{1}{6} \)", "\( \frac{1}{3} \)", "Probability", "conditional_probability"
15,"In a group of people, 80% like coffee, and 50% like tea. If 30% like both, what is the probability that a person likes coffee but not tea?", "\( \frac{20}{100} \)", "\( \frac{50}{100} \)", "\( \frac{30}{100} \)", "\( \frac{10}{100} \)", "\( \frac{20}{100} \)", "Probability", "conditional_probability"



